{
  "primary_genre": "power_growth",
  "subgenre": "xianxia",
  "secondary_genres": [
    "political_intrigue"
  ],
  "confidence": 0.89,
  "signals": [
    "Trial-based sect setting with cultivation combat and hidden strength revelation",
    "Power progression through forced exposure of abilities and survival under attack",
    "Emergence of factional conspiracy involving higher-level figures (Zhou Attendant)",
    "Shift from personal conflict to systemic threat within sect hierarchy"
  ]
}