{
  "primary_genre": "power_growth",
  "subgenre": "revenge_upgrade",
  "secondary_genres": [
    "political_intrigue"
  ],
  "confidence": 0.89,
  "signals": [
    "Protagonist faces targeted suppression during a cultivation trial, triggering hidden power reveal",
    "Clear focus on power disparity, survival under attack, and strategic retaliation",
    "Emergence of factional conspiracy involving higher-ups (Zhou Attendant), indicating internal power struggle",
    "Plot centers on turning a growth trial into an opportunity for uncovering enemies and reversing disadvantage"
  ]
}