{
  "primary_genre": "power_growth",
  "subgenre": "revenge_upgrade",
  "secondary_genres": [
    "political_intrigue"
  ],
  "confidence": 0.89,
  "signals": [
    "Protagonist faces targeted attack during a cultivation trial, forcing hidden power exposure",
    "Clear power progression through crisis survival and counterattack",
    "Emergence of factional conspiracy involving higher-ups within the sect",
    "Shift from passive victim to active investigator signals revenge-driven growth arc"
  ]
}